{"$id":"cos-v2-event-1.1","$schema":"https://json-schema.org/draft/2020-12/schema","title":"COS V2 Event 1.1","type":"object","additionalProperties":true,"properties":{"schema_version":{"const":"COS-V2-EVENT-1.1"},"event_id":{"type":"string","minLength":1},"event_type":{"type":"string","minLength":1},"occurred_at":{"type":"string","minLength":1},"project_id":{"type":"string","minLength":1},"agent_id":{"type":"string","minLength":1},"session_id":{"type":"string","minLength":1},"workstream_id":{"type":"string","minLength":1},"objective_id":{"type":"string","minLength":1},"correlation_id":{"type":"string","minLength":1},"repo":{"type":"string","minLength":1},"main_sha_observed":{"type":"string","pattern":"^[0-9a-f]{40}$"},"base_sha":{"type":"string","pattern":"^[0-9a-f]{40}$"},"authority_ceiling":{"type":"string","minLength":1},"summary":{"type":"string","minLength":1},"next_action":{"type":"string","minLength":1},"idempotency_key":{"type":"string","minLength":1},"canonical_hotel_mutation_allowed":{"type":"boolean"},"h_id_allocation_allowed":{"type":"boolean"},"outbound_allowed":{"type":"boolean"},"causation":{"type":"array","items":{"type":"string","minLength":1}}},"required":["schema_version","event_id","event_type","occurred_at","project_id","agent_id","session_id","workstream_id","objective_id","correlation_id","repo","main_sha_observed","base_sha","authority_ceiling","summary","next_action","idempotency_key","canonical_hotel_mutation_allowed","h_id_allocation_allowed","outbound_allowed"],"allOf":[{"if":{"properties":{"event_type":{"enum":["CLAIM_ACQUIRED","CLAIM_RELEASED","CLAIM_SUPERSEDED"]}},"required":["event_type"]},"then":{"required":["causation"],"properties":{"causation":{"type":"array","minItems":1}}}}]}
