{"agent_id":"AGENT-GPT56SOL-CONVERGENCE-031","authority_ceiling":"CONVERGENCE_ORCHESTRATION_AND_LEASE_REPAIR_ONLY_NO_DOMAIN_OR_OUTBOUND_AUTHORITY","base_sha":"d684852a8560adf5473dce1e621fc5c83c1a42a6","canonical_hotel_mutation_allowed":false,"causation":["claim:CLAIM-CONVERGENCE-POSTMERGE-031","predecessor:CLAIM-CONVERGENCE-POSTMERGE-028","lease:LEASE-2a254e152d4a28d077e1","released_lease:LEASE-28cde738c533e0542b27","released_lease:LEASE-e6c609774d42bc3cf410","issue:470","main:d684852a8560adf5473dce1e621fc5c83c1a42a6","fencing_high_watermark:30","repair:STALE_TOKEN28_POSTMERGE_RECOVERY"],"correlation_id":"CORR-20260916T112600Z-CONVERGENCE-031","event_id":"EVT-20260916T112600Z-CONVERGENCE-TOKEN31-ACQUIRED","event_type":"CLAIM_ACQUIRED","h_id_allocation_allowed":false,"idempotency_key":"SWITZERLAND_JOB_OS|CLAIM-CONVERGENCE-POSTMERGE-031|ACQUIRED","main_sha_observed":"d684852a8560adf5473dce1e621fc5c83c1a42a6","next_action":"Recover stale token28 lineage, port validated PR466 repair onto fresh token31 lineage, qualify exact head, terminalize claim31 and external lease31, then exact-main verify.","objective_id":"OBJ-SWISS-MAIN-SINGULARITY","occurred_at":"2026-09-16T11:26:00Z","outbound_allowed":false,"project_id":"SWITZERLAND_JOB_OS","repo":"rotprods/swiss-OS","schema_version":"COS-V2-EVENT-1.1","session_id":"SES-20260916T112600Z-CONVERGENCE-031","summary":"Fresh token31 takeover after token28 stale heartbeat, token29 no-work release, and token30 fail-closed parent-drift abort.","workstream_id":"WS-CONVERGENCE-POSTMERGE-RECOVERY"}
