{"schema_version":"COS-V2-EVENT-1.1","event_id":"EVT-20260901T221800Z-OMEGA-TOKEN12-ACQUIRED","event_type":"CLAIM_ACQUIRED","occurred_at":"2026-09-01T22:18:00Z","project_id":"SWITZERLAND_JOB_OS","agent_id":"AGENT-GPT56SOL-OMEGA-001","session_id":"SES-20260901T221800Z-OMEGA-POLICY-012","workstream_id":"WS-OMEGA-OPEN-PR-POLICY-SALVAGE","objective_id":"OBJ-OMEGA-PR-LINEAGE-POLICY-SALVAGE","correlation_id":"CORR-20260901T221800Z-OMEGA-POLICY","repo":"rotprods/swiss-OS","main_sha_observed":"6e4fe09fed5a7d3bf8768a856cd0ff29e9af4275","base_sha":"6e4fe09fed5a7d3bf8768a856cd0ff29e9af4275","authority_ceiling":"REPO_ARCHAEOLOGY_POLICY_GOVERNANCE_ONLY_NO_DOMAIN_OR_EXTERNAL_MUTATION","summary":"Acquire fencing token12 for OMEGA open-PR lineage reconstruction, execution-stop policy salvage and typed salvage routing on exact post-token11 main.","next_action":"Materialize token12 projections, salvage PR #414 policy, create durable salvage routes for unique historical capabilities, then close superseded source PRs without domain mutation.","idempotency_key":"SWITZERLAND_JOB_OS|CLAIM-OMEGA-OPEN-PR-POLICY-012|ACQUIRED","canonical_hotel_mutation_allowed":false,"h_id_allocation_allowed":false,"outbound_allowed":false,"causation":["claim:CLAIM-OMEGA-OPEN-PR-POLICY-012","main:6e4fe09fed5a7d3bf8768a856cd0ff29e9af4275","issue:426:CLOSED"]}
