{"schema_version":"COS-V2-EVENT-1.1","event_id":"EVT-20260902T152200Z-CRM-TOKEN16-ACQUIRED","event_type":"CLAIM_ACQUIRED","occurred_at":"2026-09-02T15:22:00Z","project_id":"SWITZERLAND_JOB_OS","agent_id":"AGENT-GPT56SOL-GRAPHV2-001","session_id":"SES-20260902T152200Z-CRM-B07-B09-016","workstream_id":"WS-CRM-CURRENT-B07-B09","objective_id":"OBJ-CURRENT-SOURCE-B07-B09-FORMAL-REVIEW","correlation_id":"CORR-20260902T152200Z-CRM-B07-B09-016","repo":"rotprods/swiss-OS","main_sha_observed":"1072d5cfb33beee3f2afcd31a59ba00c514df170","base_sha":"1072d5cfb33beee3f2afcd31a59ba00c514df170","authority_ceiling":"CRM_PREAUTH_ENTITY_RESOLUTION_AND_MAPPING_REVIEW_ONLY_NO_HOTEL_AUTHORITY_PROMOTION_OR_EXTERNAL_MUTATION","summary":"Acquire fencing token16 from exact-main idle state to formalize evidence-backed current-source B07-B09 entity-resolution reviews, preserving E4 authority and all H-ID/outbound locks.","next_action":"Persist heartbeat, formalize B07-B09 decisions from fresh E4/source evidence, test Wilerbad locality-variant match without premature authority promotion, derive NEXT, qualify full gauntlet, merge only if fresh, then release token16.","idempotency_key":"SWITZERLAND_JOB_OS|CLAIM-CRM-CURRENT-B07-B09-016|ACQUIRED","canonical_hotel_mutation_allowed":false,"h_id_allocation_allowed":false,"outbound_allowed":false,"causation":["claim:CLAIM-CRM-CURRENT-B07-B09-016","main:1072d5cfb33beee3f2afcd31a59ba00c514df170","source:HS-MEMBER-DE-33339392661","fencing_high_watermark:15","active_claims:0"]}
