{"agent_id":"AGENT-GPT56SOL-CONVERGENCE-021","authority_ceiling":"CONVERGENCE_ORCHESTRATION_AND_LEASE_REPAIR_ONLY_NO_DOMAIN_OR_OUTBOUND_AUTHORITY","base_sha":"3c902a791be0e8df1db564034e211ea90c41f1b3","canonical_hotel_mutation_allowed":false,"causation":["claim:CLAIM-CONVERGENCE-LINEAGE-021","predecessor:CLAIM-CONVERGENCE-LEASE-020","lease:LEASE-0479ab715ce626b5422f","pr:463","run:34718476671","wave:WAVE-20260912-CONVERGENCE-LINEAGE-003"],"correlation_id":"CORR-20260912T203915Z-CONVERGENCE-021","event_id":"EVT-20260912T205940-CONVERGENCE-TOKEN21-CLAIM-RELEASED","event_type":"CLAIM_RELEASED","h_id_allocation_allowed":false,"idempotency_key":"SWITZERLAND_JOB_OS|CLAIM-CONVERGENCE-LINEAGE-021|RELEASED|MAIN-SINGULARITY","main_sha_observed":"3c902a791be0e8df1db564034e211ea90c41f1b3","next_action":"Rebuild zero-writer Runtime Graph/V2/Context Survival, release the external CAS lease, run one final exact-head terminal gauntlet, re-read live main and await explicit owner merge instruction for PR #463.","objective_id":"OBJ-SWISS-MAIN-SINGULARITY","occurred_at":"2026-09-12T20:59:40Z","outbound_allowed":false,"project_id":"SWITZERLAND_JOB_OS","repo":"rotprods/swiss-OS","schema_version":"COS-V2-EVENT-1.1","session_id":"SES-20260912T203915Z-CONVERGENCE-021","summary":"Token21 released after terminal-lineage succession repair, cumulative claim-scope reconciliation and exact-head full repository gauntlet all passed with zero domain/outbound authority mutation.","workstream_id":"WS-CONVERGENCE-LEASE-REPAIR"}
