{"schema_version":"COS-V2-EVENT-1.1","event_id":"EVT-20260902T080100Z-GRAPHV2-TOKEN14-CLAIM-ACQUIRED","event_type":"CLAIM_ACQUIRED","occurred_at":"2026-09-02T08:01:00Z","project_id":"SWITZERLAND_JOB_OS","agent_id":"AGENT-GPT56SOL-GRAPHV2-001","session_id":"SES-20260902T080100Z-GRAPHV2-PLATFORM-TRUTH-014","workstream_id":"WS-GRAPHV2-PLATFORM-TRUTH","objective_id":"OBJ-PLATFORM-TRUTH-GATE","correlation_id":"CORR-20260902T080100Z-PLATFORM-TRUTH-014","repo":"rotprods/swiss-OS","main_sha_observed":"54da9d184e9302fb503601722877f85c51a5444b","base_sha":"54da9d184e9302fb503601722877f85c51a5444b","authority_ceiling":"REPO_PLATFORM_GUARDS_CONTINUITY_ONLY_NO_DOMAIN_OR_EXTERNAL_MUTATION","summary":"Acquire fencing token14 to make GitHub platform-protection truth explicit and gate PRODUCTION_AUTHORITY on verified platform readback without widening domain authority.","next_action":"Implement live platform readback guard, integrate local/CI and continuity, emit KEEP/DISCARD receipt only after full gauntlet, then release token14.","idempotency_key":"SWITZERLAND_JOB_OS|CLAIM-GRAPHV2-PLATFORM-TRUTH-014|ACQUIRED","canonical_hotel_mutation_allowed":false,"h_id_allocation_allowed":false,"outbound_allowed":false,"causation":["claim:CLAIM-GRAPHV2-PLATFORM-TRUTH-014","issue:441","issue:442","main:54da9d184e9302fb503601722877f85c51a5444b"]}