{"schema_version":"COS-V2-EVENT-1.1","event_id":"EVT-20260910T134401Z-CRM-TOKEN18-WORK-STARTED","event_type":"WORK_STARTED","occurred_at":"2026-09-10T13:44:01Z","project_id":"SWITZERLAND_JOB_OS","agent_id":"AGENT-GPT56SOL-CRM-018","session_id":"SES-20260910T134400Z-CRM-ENTITY-018","workstream_id":"WS-CRM-ENTITY-RESOLUTION","objective_id":"CRM_UNIVERSE_COMPLETE","correlation_id":"CORR-20260910T134400Z-CRM-ENTITY-018","repo":"rotprods/swiss-OS","main_sha_observed":"dcf70473e1daa8a26cb9d9d3395aa897acad356d","base_sha":"dcf70473e1daa8a26cb9d9d3395aa897acad356d","authority_ceiling":"PREAUTH_LOCALITY_AND_SRR_DECISION_ONLY_NO_CANONICAL_MUTATION","summary":"Begin exact B11 review of the ten deterministic CURRENT_UNRESOLVED_LT350000_ZERO_CANONICAL_CITY records using locality guard, current evidence, canonical comparators and EGR.","next_action":"Capture current-source evidence for all ten records and classify only evidence-supported PREAUTH dispositions.","idempotency_key":"SWITZERLAND_JOB_OS|SES-20260910T134400Z-CRM-ENTITY-018|WORK_STARTED","canonical_hotel_mutation_allowed":false,"h_id_allocation_allowed":false,"outbound_allowed":false,"causation":["claim:CLAIM-CRM-ENTITY-RESOLUTION-018","event:EVT-20260910T134400Z-CRM-TOKEN18-CLAIM-ACQUIRED"]}
