{"agent_id":"AGENT-GPT56SOL-CONVERGENCE-023","authority_ceiling":"CONVERGENCE_ORCHESTRATION_AND_LEASE_REPAIR_ONLY_NO_DOMAIN_OR_OUTBOUND_AUTHORITY","base_sha":"3c902a791be0e8df1db564034e211ea90c41f1b3","canonical_hotel_mutation_allowed":false,"causation":["claim:CLAIM-CONVERGENCE-TERMINALIZATION-023","predecessor:CLAIM-CONVERGENCE-LINEAGE-021","lease:LEASE-54ccb9d796785154dee9","main:3c902a791be0e8df1db564034e211ea90c41f1b3","fencing_high_watermark:22","repair:TERMINALIZATION_PARITY"],"correlation_id":"CORR-20260913T180330Z-CONVERGENCE-023","event_id":"EVT-20260913T180330Z-CONVERGENCE-TOKEN23-ACQUIRED","event_type":"CLAIM_ACQUIRED","h_id_allocation_allowed":false,"idempotency_key":"SWITZERLAND_JOB_OS|CLAIM-CONVERGENCE-TERMINALIZATION-023|ACQUIRED","main_sha_observed":"3c902a791be0e8df1db564034e211ea90c41f1b3","next_action":"Repair the live lease guard so zero active claims cannot coexist with an ACTIVE global lease, add adversarial regression coverage, document release/readback terminalization law, rebuild projections and qualify exact head.","objective_id":"OBJ-SWISS-MAIN-SINGULARITY","occurred_at":"2026-09-13T18:03:30Z","outbound_allowed":false,"project_id":"SWITZERLAND_JOB_OS","repo":"rotprods/swiss-OS","schema_version":"COS-V2-EVENT-1.1","session_id":"SES-20260913T180300Z-CONVERGENCE-023","summary":"Acquire token23 under the global CAS lease for a bounded terminalization parity repair discovered by the multi-agent cemetery sweep.","workstream_id":"WS-CONVERGENCE-TERMINALIZATION-PARITY"}
