{"agent_id":"AGENT-GPT56SOL-SWARM-037","authority_ceiling":"CONVERGENCE_ORCHESTRATION_AND_LEASE_REPAIR_ONLY_NO_DOMAIN_OR_OUTBOUND_AUTHORITY","base_sha":"012ddfc4953eaed39f8b75a61a71ee5aaffdcc02","canonical_hotel_mutation_allowed":false,"causation":["claim:CLAIM-CONVERGENCE-POSTMERGE-033","lease:LEASE-1371b877370d6af03225","predecessor:CLAIM-CONVERGENCE-POSTMERGE-032","ci:35338109700:SUCCESS"],"correlation_id":"CORR-20260918T111200Z-SWARM-037","event_id":"EVT-20260918T111300Z-CONVERGENCE-TOKEN33-WORK-STARTED","event_type":"WORK_STARTED","h_id_allocation_allowed":false,"idempotency_key":"SWITZERLAND_JOB_OS|CLAIM-CONVERGENCE-POSTMERGE-033|WORK_STARTED","main_sha_observed":"012ddfc4953eaed39f8b75a61a71ee5aaffdcc02","next_action":"Materialize token33 active projections, open a bounded reseal PR, qualify exact head, then terminalize claim33 and release/read back lease33.","objective_id":"OBJ-SWISS-MAIN-SINGULARITY","occurred_at":"2026-09-18T11:13:00Z","outbound_allowed":false,"project_id":"SWITZERLAND_JOB_OS","repo":"rotprods/swiss-OS","schema_version":"COS-V2-EVENT-1.1","session_id":"SES-20260918T111200Z-SWARM-037","summary":"Token33 begins bounded post-merge canonical reseal. No CRM, H-ID, candidate-private, application or outbound authority is granted.","workstream_id":"WS-CONVERGENCE-POSTMERGE-CANONICAL-RESEAL"}
