{"schema_version":"COS-V2-EVENT-1.1","event_id":"EVT-20260902T051300Z-GRAPHV2-TOKEN12-CLAIM-RELEASED","event_type":"CLAIM_RELEASED","occurred_at":"2026-09-02T05:13:00Z","project_id":"SWITZERLAND_JOB_OS","agent_id":"AGENT-GPT56SOL-GRAPHV2-001","session_id":"SES-20260901T222000Z-GRAPHV2-AGENT-RUNTIME-012","workstream_id":"WS-AGENT-RUNTIME-GRAPH","objective_id":"OBJ-AGENT-RUNTIME-GRAPH-ACTIVATION","correlation_id":"CORR-20260901T222000Z-AGENT-RUNTIME-012","repo":"rotprods/swiss-OS","main_sha_observed":"f090b98f0236d2ec9e0fe95f892d4c1d5de2516f","base_sha":"f090b98f0236d2ec9e0fe95f892d4c1d5de2516f","authority_ceiling":"AGENT_RUNTIME_GRAPH_COORDINATION_ONLY_NO_DOMAIN_OR_EXTERNAL_MUTATION","summary":"Release fencing token12 after PR #433 merged the canonical Agent Runtime Graph and pre-merge run 33593631855 passed deterministic runtime/coordination guards, Context Survival, zero-context death drill, 568 unit tests and manifest canary.","next_action":"Rebuild runtime and coordination projections to zero active token12 work, qualify the bounded release PR, merge it, then require any successor workstream to acquire fencing token >12 with a new session_id.","idempotency_key":"SWITZERLAND_JOB_OS|CLAIM-GRAPHV2-AGENT-RUNTIME-012|RELEASED|POSTMERGE","canonical_hotel_mutation_allowed":false,"h_id_allocation_allowed":false,"outbound_allowed":false,"causation":["claim:CLAIM-GRAPHV2-AGENT-RUNTIME-012","pr:433:MERGED","iteration:ITER-fc4c2a920b88f86ba2e2:KEEP","run:33593631855:SUCCESS","main:f090b98f0236d2ec9e0fe95f892d4c1d5de2516f"]}
