{"schema_version":"COS-V2-EVENT-1.1","event_id":"EVT-20260910T102800Z-CRM-TOKEN17-CLAIM-RELEASED","event_type":"CLAIM_RELEASED","occurred_at":"2026-09-10T10:28:00Z","project_id":"SWITZERLAND_JOB_OS","agent_id":"AGENT-GPT56SOL-CRM-017","session_id":"SES-20260910T092500Z-CRM-ENTITY-017","workstream_id":"WS-CRM-ENTITY-RESOLUTION","objective_id":"CRM_UNIVERSE_COMPLETE","correlation_id":"CORR-20260910T092500Z-CRM-ENTITY-017","repo":"rotprods/swiss-OS","main_sha_observed":"8d898e5cf5fb69efb151d26236f8659a52d3c233","base_sha":"8d898e5cf5fb69efb151d26236f8659a52d3c233","authority_ceiling":"PREAUTH_LOCALITY_AND_SRR_DECISION_ONLY_NO_CANONICAL_MUTATION","summary":"Release token17 after B10 completed the deterministic 485-row zero-city lane reconstruction, locality normalization guard, B10 evidence/decision packet and B11 fail-closed NEXT derivation without authority or outbound mutation.","next_action":"Rebuild V2 coordination projections to zero active token17 work with fencing high-watermark 17, run full repo gauntlet, merge only from a fresh main, then require token >17 for B11 or any further material mutation.","idempotency_key":"SWITZERLAND_JOB_OS|CLAIM-CRM-ENTITY-RESOLUTION-017|RELEASED|B10","canonical_hotel_mutation_allowed":false,"h_id_allocation_allowed":false,"outbound_allowed":false,"causation":["claim:CLAIM-CRM-ENTITY-RESOLUTION-017","wave:CURR-U1403-B10","state:docs/state/CRM_CURRENT_UNRESOLVED_LT350_B10_2026-09-10.json"]}