{"agent_id":"AGENT-GPT56SOL-SWARM-036","authority_ceiling":"CONVERGENCE_ORCHESTRATION_AND_LEASE_REPAIR_ONLY_NO_DOMAIN_OR_OUTBOUND_AUTHORITY","base_sha":"d684852a8560adf5473dce1e621fc5c83c1a42a6","canonical_hotel_mutation_allowed":false,"causation":["claim:CLAIM-CONVERGENCE-POSTMERGE-032","iteration:ITER-convergence-postmerge-recovery-token32","qualification:repo-guard:35218123802:PASS","pr:472","predecessor:CLAIM-CONVERGENCE-POSTMERGE-031"],"correlation_id":"CORR-20260917T113300Z-SWARM-036","event_id":"EVT-20260917T115600Z-CONVERGENCE-TOKEN32-CLAIM-RELEASED","event_type":"CLAIM_RELEASED","h_id_allocation_allowed":false,"idempotency_key":"SWITZERLAND_JOB_OS|CLAIM-CONVERGENCE-POSTMERGE-032|RELEASED","main_sha_observed":"d684852a8560adf5473dce1e621fc5c83c1a42a6","next_action":"CAS-release external lease32 and require readback before publishing COMPLETE heartbeat; then reseal zero-writer projections and run final exact-head gauntlet.","objective_id":"OBJ-SWISS-MAIN-SINGULARITY","occurred_at":"2026-09-17T11:56:00Z","outbound_allowed":false,"project_id":"SWITZERLAND_JOB_OS","repo":"rotprods/swiss-OS","schema_version":"COS-V2-EVENT-1.1","session_id":"SES-20260917T113300Z-SWARM-036","summary":"Token32 Git claim released KEEP after fully green active-state exact-head qualification. COMPLETE is withheld until the independent external lease surface is released and read back.","workstream_id":"WS-CONVERGENCE-POSTMERGE-RECOVERY"}
