{"agent_id":"AGENT-GPT56SOL-SWARM-037","authority_ceiling":"CONVERGENCE_ORCHESTRATION_AND_LEASE_REPAIR_ONLY_NO_DOMAIN_OR_OUTBOUND_AUTHORITY","base_sha":"012ddfc4953eaed39f8b75a61a71ee5aaffdcc02","canonical_hotel_mutation_allowed":false,"causation":["claim:CLAIM-CONVERGENCE-POSTMERGE-033","predecessor:CLAIM-CONVERGENCE-POSTMERGE-032","lease:LEASE-1371b877370d6af03225","main:012ddfc4953eaed39f8b75a61a71ee5aaffdcc02","fencing_high_watermark:32","qualification:repo-guard-35338109700:PASS","repair:POSTMERGE_CANONICAL_RESEAL"],"correlation_id":"CORR-20260918T111200Z-SWARM-037","event_id":"EVT-20260918T111200Z-CONVERGENCE-TOKEN33-ACQUIRED","event_type":"CLAIM_ACQUIRED","h_id_allocation_allowed":false,"idempotency_key":"SWITZERLAND_JOB_OS|CLAIM-CONVERGENCE-POSTMERGE-033|ACQUIRED","main_sha_observed":"012ddfc4953eaed39f8b75a61a71ee5aaffdcc02","next_action":"Reseal canonical post-merge coordination truth after PR472 merged green on main; remove stale pre-merge blockers without widening domain or outbound authority.","objective_id":"OBJ-SWISS-MAIN-SINGULARITY","occurred_at":"2026-09-18T11:12:00Z","outbound_allowed":false,"project_id":"SWITZERLAND_JOB_OS","repo":"rotprods/swiss-OS","schema_version":"COS-V2-EVENT-1.1","session_id":"SES-20260918T111200Z-SWARM-037","summary":"Fresh token33 writer acquired from zero-writer watermark32 solely to reconcile post-merge canonical projections after successful main qualification.","workstream_id":"WS-CONVERGENCE-POSTMERGE-CANONICAL-RESEAL"}
