{"schema_version":"COS-V2-EVENT-1.1","event_id":"EVT-20260912T190500Z-CONVERGENCE-TOKEN20-ACQUIRED","event_type":"CLAIM_ACQUIRED","occurred_at":"2026-09-12T19:05:00Z","project_id":"SWITZERLAND_JOB_OS","agent_id":"AGENT-GPT56SOL-CONVERGENCE-020","session_id":"SES-20260912T190500Z-CONVERGENCE-020","workstream_id":"WS-CONVERGENCE-LEASE-REPAIR","objective_id":"OBJ-SWISS-MAIN-SINGULARITY","correlation_id":"CORR-20260912T190500Z-CONVERGENCE-020","repo":"rotprods/swiss-OS","main_sha_observed":"3c902a791be0e8df1db564034e211ea90c41f1b3","base_sha":"3c902a791be0e8df1db564034e211ea90c41f1b3","authority_ceiling":"CONVERGENCE_ORCHESTRATION_AND_LEASE_REPAIR_ONLY_NO_DOMAIN_OR_OUTBOUND_AUTHORITY","summary":"Acquire fresh-parent token20 after fail-closed token19 release caused by canonical main drift. Global CAS lease holder, session and parent now match main 3c902a791be0e8df1db564034e211ea90c41f1b3.","next_action":"Absorb the research-only main advancement into the single convergence lineage, run exact-head lease/coordination gauntlet, then reconcile post-B11 projections without domain/outbound mutation.","idempotency_key":"SWITZERLAND_JOB_OS|CLAIM-CONVERGENCE-LEASE-020|ACQUIRED","canonical_hotel_mutation_allowed":false,"h_id_allocation_allowed":false,"outbound_allowed":false,"causation":["claim:CLAIM-CONVERGENCE-LEASE-019:SUPERSEDED","lease:LEASE-d40ee59f42302ee1165d","main:3c902a791be0e8df1db564034e211ea90c41f1b3","fencing_high_watermark:19"]}