{"schema_version":"COS-V2-EVENT-1.1","event_id":"EVT-20260901T222000Z-GRAPHV2-TOKEN12-ACQUIRED","event_type":"CLAIM_ACQUIRED","occurred_at":"2026-09-01T22:20:00Z","project_id":"SWITZERLAND_JOB_OS","agent_id":"AGENT-GPT56SOL-GRAPHV2-001","session_id":"SES-20260901T222000Z-GRAPHV2-AGENT-RUNTIME-012","workstream_id":"WS-AGENT-RUNTIME-GRAPH","objective_id":"OBJ-AGENT-RUNTIME-GRAPH-ACTIVATION","correlation_id":"CORR-20260901T222000Z-AGENT-RUNTIME-012","repo":"rotprods/swiss-OS","main_sha_observed":"46b165507b86b3da16b5885302a14b73105fc89d","base_sha":"46b165507b86b3da16b5885302a14b73105fc89d","authority_ceiling":"AGENT_RUNTIME_GRAPH_COORDINATION_ONLY_NO_DOMAIN_OR_EXTERNAL_MUTATION","summary":"Acquire fencing token12 to activate the merged GRAPH-REFACTOR-V2 agent autoresearch runtime as a canonical Agent Runtime Graph and zero-context recovery surface.","next_action":"Build deterministic agent/worktree/PR/iteration projection, persist first complete iteration receipt and prove death-safe recovery.","idempotency_key":"SWITZERLAND_JOB_OS|CLAIM-GRAPHV2-AGENT-RUNTIME-012|ACQUIRED","canonical_hotel_mutation_allowed":false,"h_id_allocation_allowed":false,"outbound_allowed":false,"causation":["claim:CLAIM-GRAPHV2-AGENT-RUNTIME-012","issue:432","issue:430"]}
