{"schema_version":"COS-V2-EVENT-1.1","event_id":"EVT-20260902T074600Z-GRAPHV2-TOKEN13-CLAIM-RELEASED","event_type":"CLAIM_RELEASED","occurred_at":"2026-09-02T07:46:00Z","project_id":"SWITZERLAND_JOB_OS","agent_id":"AGENT-GPT56SOL-GRAPHV2-001","session_id":"SES-20260902T052300Z-GRAPHV2-MATERIAL-LINEAGE-013","workstream_id":"WS-GRAPHV2-MATERIAL-LINEAGE","objective_id":"OBJ-MATERIAL-MUTATION-LINEAGE-ENFORCEMENT","correlation_id":"CORR-20260902T052300Z-MATERIAL-LINEAGE-013","repo":"rotprods/swiss-OS","main_sha_observed":"10cb8f9a20b96ce9906cdc5427a66eb3e728acf2","base_sha":"10cb8f9a20b96ce9906cdc5427a66eb3e728acf2","authority_ceiling":"REPO_COORDINATION_GUARDS_TESTS_ONLY_NO_DOMAIN_OR_EXTERNAL_MUTATION","summary":"Release fencing token13 after PR #439 merged material mutation lineage enforcement and final run 33604866540 passed lineage guard, deterministic runtime/coordination projections, Context Survival, zero-context death drill, unit tests and manifest canary with durable KEEP receipt.","next_action":"Rebuild Runtime Graph and coordination projections to zero active token13 work, qualify the bounded release PR, merge it, then require any successor material work to acquire a new session and fencing token >13.","idempotency_key":"SWITZERLAND_JOB_OS|CLAIM-GRAPHV2-MATERIAL-LINEAGE-013|RELEASED|POSTMERGE","canonical_hotel_mutation_allowed":false,"h_id_allocation_allowed":false,"outbound_allowed":false,"causation":["claim:CLAIM-GRAPHV2-MATERIAL-LINEAGE-013","pr:439:MERGED","iteration:ITER-material-lineage-token13:KEEP","run:33604866540:SUCCESS","main:10cb8f9a20b96ce9906cdc5427a66eb3e728acf2"]}
