{"schema_version":"COS-V2-EVENT-1.1","event_id":"EVT-20260912T203018Z-CONVERGENCE-TOKEN20-CLAIM-RELEASED","event_type":"CLAIM_RELEASED","occurred_at":"2026-09-12T20:30:18Z","project_id":"SWITZERLAND_JOB_OS","agent_id":"AGENT-GPT56SOL-CONVERGENCE-020","session_id":"SES-20260912T190500Z-CONVERGENCE-020","workstream_id":"WS-CONVERGENCE-LEASE-REPAIR","objective_id":"OBJ-SWISS-MAIN-SINGULARITY","correlation_id":"CORR-20260912T190500Z-CONVERGENCE-020","repo":"rotprods/swiss-OS","main_sha_observed":"3c902a791be0e8df1db564034e211ea90c41f1b3","base_sha":"3c902a791be0e8df1db564034e211ea90c41f1b3","authority_ceiling":"CONVERGENCE_ORCHESTRATION_AND_LEASE_REPAIR_ONLY_NO_DOMAIN_OR_OUTBOUND_AUTHORITY","summary":"Token20 released after the atomic writer-lease repair, post-B11 projection convergence, cold-handoff compatibility repair, full exact-head gauntlet, 620/620 unit tests and manifest canary all passed with zero domain/outbound authority mutation.","next_action":"Rebuild Runtime Graph/V2 coordination to zero active writers with fencing high-watermark 20, release the external CAS lease, run one final exact-head gauntlet on terminal state, then await explicit owner merge instruction for PR #463.","idempotency_key":"SWITZERLAND_JOB_OS|CLAIM-CONVERGENCE-LEASE-020|RELEASED|MAIN-SINGULARITY","canonical_hotel_mutation_allowed":false,"h_id_allocation_allowed":false,"outbound_allowed":false,"causation":["claim:CLAIM-CONVERGENCE-LEASE-020","pr:463","wave:WAVE-20260912-CONVERGENCE-002"]}
