{"schema_version":"COS-V2-EVENT-1.1","event_id":"EVT-20260901T221000Z-GRAPHV2-TOKEN11-CLAIM-RELEASED","event_type":"CLAIM_RELEASED","occurred_at":"2026-09-01T22:10:00Z","project_id":"SWITZERLAND_JOB_OS","agent_id":"AGENT-GPT56SOL-GRAPHV2-001","session_id":"SES-20260901T213900Z-GRAPHV2-FORWARD-011","workstream_id":"WS-GRAPH-V2-FORWARD-LIFECYCLE-CONTRACT","objective_id":"OBJ-V2-FORWARD-LIFECYCLE-CAUSATION","correlation_id":"CORR-20260901T213900Z-GRAPHV2-FORWARD","repo":"rotprods/swiss-OS","main_sha_observed":"f4fbfeea36e746eef98185076d11e2231f3a0640","base_sha":"f4fbfeea36e746eef98185076d11e2231f3a0640","authority_ceiling":"COORDINATION_SCHEMA_WRITER_TESTS_ONLY_NO_DOMAIN_OR_EXTERNAL_MUTATION","summary":"Release fencing token11 after PR #428 merged and exact-main repo-guard/materializer qualification passed.","next_action":"Rebuild event-derived coordination projections to zero active claims, run post-merge qualification, merge the bounded release PR, close issue #426, then acquire token12 before OMEGA repository archaeology resumes.","idempotency_key":"SWITZERLAND_JOB_OS|CLAIM-GRAPHV2-FORWARD-LIFECYCLE-011|RELEASED|POSTMERGE","canonical_hotel_mutation_allowed":false,"h_id_allocation_allowed":false,"outbound_allowed":false,"causation":["claim:CLAIM-GRAPHV2-FORWARD-LIFECYCLE-011","pr:428:MERGED","main:f4fbfeea36e746eef98185076d11e2231f3a0640"]}
